A1: 项目1 安全用电与仪器使用（课程目标1和3）
A2: 序号 | B2: 学号 | C2: 姓名 | D2: 班级 | E2: 项目表现 | F2: 作品测试 | J2: 项目表现 | K2: 作品测试
E3: 万用表测量元器件参数评分 | F3: 测试点1（LED亮） | G3: 测试点2（电压） | H3: 测试点3（电流） | M3: 作品测试评分细则：3个√95分；2个√85分；1个√75分；0个√，但是项目表现中以上65分；0个√，但是项目表现中以下50分
A4: 1 | B4: 20224968 | C4: 李诚 | D4: 22电子信息工程（一本）1班 | E4: 92.5 | F4: √ | G4: √ | H4: √ | J4: =E4 -> 92.5 | K4: 95
A5: 2 | B5: 20224969 | C5: 廖凯 | D5: 22电子信息工程（一本）1班 | E5: 87.5 | F5: √ | G5: √ | H5: √ | J5: =E5 -> 87.5 | K5: 95
A6: 3 | B6: 20224970 | C6: 陈依如 | D6: 22电子信息工程（一本）1班 | E6: 97 | F6: √ | G6: √ | H6: √ | J6: =E6 -> 97 | K6: 95
A7: 4 | B7: 20224971 | C7: 谢超 | D7: 22电子信息工程（一本）1班 | E7: 97 | F7: √ | G7: √ | H7: √ | J7: =E7 -> 97 | K7: 95
A8: 5 | B8: 20224972 | C8: 啜雨欣 | D8: 22电子信息工程（一本）1班 | E8: 97 | F8: √ | G8: √ | H8: √ | J8: =E8 -> 97 | K8: 95
A9: 6 | B9: 20224973 | C9: 刘亚宁 | D9: 22电子信息工程（一本）1班 | E9: 94 | F9: √ | G9: √ | H9: √ | J9: =E9 -> 94 | K9: 95
A10: 7 | B10: 20224974 | C10: 周世愉 | D10: 22电子信息工程（一本）1班 | E10: 94 | F10: √ | G10: √ | H10: √ | J10: =E10 -> 94 | K10: 95
A11: 8 | B11: 20224975 | C11: 陈志敏 | D11: 22电子信息工程（一本）1班 | E11: 94 | F11: √ | G11: √ | H11: √ | J11: =E11 -> 94 | K11: 95
A12: 9 | B12: 20224976 | C12: 李欣 | D12: 22电子信息工程（一本）1班 | E12: 97 | F12: √ | G12: √ | H12: √ | J12: =E12 -> 97 | K12: 95
A13: 10 | B13: 20224977 | C13: 陈辉 | D13: 22电子信息工程（一本）1班 | E13: 94 | F13: √ | G13: √ | H13: √ | J13: =E13 -> 94 | K13: 95
A14: 11 | B14: 20224978 | C14: 黄影 | D14: 22电子信息工程（一本）1班 | E14: 94 | F14: √ | G14: √ | H14: √ | J14: =E14 -> 94 | K14: 95
A15: 12 | B15: 20224979 | C15: 温李吟雪 | D15: 22电子信息工程（一本）1班 | E15: 92.5 | F15: √ | G15: √ | H15: √ | J15: =E15 -> 92.5 | K15: 95
A16: 13 | B16: 20224980 | C16: 彭敏 | D16: 22电子信息工程（一本）1班 | E16: 85 | F16: √ | G16: √ | H16: √ | J16: =E16 -> 85 | K16: 95
A17: 14 | B17: 20224981 | C17: 龚琪 | D17: 22电子信息工程（一本）1班 | E17: 88 | F17: √ | G17: √ | H17: √ | J17: =E17 -> 88 | K17: 95
A18: 15 | B18: 20224982 | C18: 钟鹏飞 | D18: 22电子信息工程（一本）1班 | E18: 97 | F18: √ | G18: √ | H18: √ | J18: =E18 -> 97 | K18: 95
A19: 16 | B19: 20224983 | C19: 张雨娜 | D19: 22电子信息工程（一本）1班 | E19: 97 | F19: √ | G19: √ | H19: √ | J19: =E19 -> 97 | K19: 95
A20: 17 | B20: 20224984 | C20: 张日华 | D20: 22电子信息工程（一本）1班 | E20: 91 | F20: √ | G20: √ | H20: √ | J20: =E20 -> 91 | K20: 95
A21: 18 | B21: 20224985 | C21: 张微 | D21: 22电子信息工程（一本）1班 | E21: 88 | F21: √ | G21: √ | H21: √ | J21: =E21 -> 88 | K21: 95
A22: 19 | B22: 20224986 | C22: 张越 | D22: 22电子信息工程（一本）1班 | E22: 94 | F22: √ | G22: √ | H22: √ | J22: =E22 -> 94 | K22: 95
A23: 20 | B23: 20224987 | C23: 刘振经 | D23: 22电子信息工程（一本）1班 | E23: 94 | F23: √ | G23: √ | H23: √ | J23: =E23 -> 94 | K23: 95
A24: 21 | B24: 20224988 | C24: 龚静薇 | D24: 22电子信息工程（一本）1班 | E24: 97 | F24: √ | G24: √ | H24: √ | J24: =E24 -> 97 | K24: 95
A25: 22 | B25: 20224989 | C25: 胡梓瑞 | D25: 22电子信息工程（一本）1班 | E25: 94 | F25: √ | G25: √ | H25: √ | J25: =E25 -> 94 | K25: 95
A26: 23 | B26: 20224990 | C26: 游梓鑫 | D26: 22电子信息工程（一本）1班 | E26: 92.5 | F26: √ | G26: √ | H26: √ | J26: =E26 -> 92.5 | K26: 95
A27: 24 | B27: 20224991 | C27: 曾莉 | D27: 22电子信息工程（一本）1班 | E27: 94 | F27: √ | G27: √ | H27: √ | J27: =E27 -> 94 | K27: 95
A28: 25 | B28: 20224992 | C28: 张馨怡 | D28: 22电子信息工程（一本）1班 | E28: 97 | F28: √ | G28: √ | H28: √ | J28: =E28 -> 97 | K28: 95
A29: 26 | B29: 20224993 | C29: 吴光杰 | D29: 22电子信息工程（一本）1班 | E29: 97 | F29: √ | G29: √ | H29: √ | J29: =E29 -> 97 | K29: 95
A30: 27 | B30: 20224994 | C30: 乐思蕊 | D30: 22电子信息工程（一本）1班 | E30: 97 | F30: √ | G30: √ | H30: √ | J30: =E30 -> 97 | K30: 95
A31: 28 | B31: 20224995 | C31: 王至尧 | D31: 22电子信息工程（一本）1班 | E31: 97 | F31: √ | G31: √ | H31: √ | J31: =E31 -> 97 | K31: 95
A32: 29 | B32: 20224996 | C32: 高官亮 | D32: 22电子信息工程（一本）1班 | E32: 88 | F32: √ | G32: √ | H32: √ | J32: =E32 -> 88 | K32: 95
A33: 30 | B33: 20224997 | C33: 朱武略 | D33: 22电子信息工程（一本）1班 | E33: 97 | F33: √ | G33: √ | H33: √ | J33: =E33 -> 97 | K33: 95
A34: 31 | B34: 20224998 | C34: 王世璇 | D34: 22电子信息工程（一本）1班 | E34: 91 | F34: √ | G34: √ | H34: √ | J34: =E34 -> 91 | K34: 95
A35: 32 | B35: 20224999 | C35: 徐春林 | D35: 22电子信息工程（一本）1班 | E35: 91 | F35: √ | G35: √ | H35: √ | J35: =E35 -> 91 | K35: 95
A36: 33 | B36: 20225000 | C36: 周彬 | D36: 22电子信息工程（一本）1班 | E36: 91 | F36: √ | G36: √ | H36: √ | J36: =E36 -> 91 | K36: 95
A37: 34 | B37: 20225001 | C37: 熊思婕 | D37: 22电子信息工程（一本）1班 | E37: 97 | F37: √ | G37: √ | H37: √ | J37: =E37 -> 97 | K37: 95
A38: 35 | B38: 20225002 | C38: 万佳豪 | D38: 22电子信息工程（一本）1班 | E38: 91 | F38: √ | G38: √ | H38: √ | J38: =E38 -> 91 | K38: 95
A39: 36 | B39: 20225003 | C39: 洪晓莉 | D39: 22电子信息工程（一本）1班 | E39: 95 | F39: √ | G39: √ | H39: √ | J39: =E39 -> 95 | K39: 95
A40: 37 | B40: 20225004 | C40: 肖朝鑫 | D40: 22电子信息工程（一本）1班 | E40: 95.5 | F40: √ | G40: √ | H40: √ | J40: =E40 -> 95.5 | K40: 95
A41: 38 | B41: 20225005 | C41: 师甜甜 | D41: 22电子信息工程（一本）1班 | E41: 95 | F41: √ | G41: √ | H41: √ | J41: =E41 -> 95 | K41: 95
A42: 39 | B42: 20225006 | C42: 张斌 | D42: 22电子信息工程（一本）1班 | E42: 94 | F42: √ | G42: √ | H42: √ | J42: =E42 -> 94 | K42: 95
A43: 40 | B43: 20225007 | C43: 王冠棋 | D43: 22电子信息工程（一本）1班 | E43: 91 | F43: √ | G43: √ | H43: √ | J43: =E43 -> 91 | K43: 95
A45: 41 | B45: 20225008 | C45: 李璇 | D45: 22电子信息工程（一本）2班 | E45: 93 | F45: √ | G45: √ | H45: √ | J45: =E45 -> 93 | K45: 95
A46: 42 | B46: 20225009 | C46: 张华康 | D46: 22电子信息工程（一本）2班 | E46: 88 | F46: √ | G46: √ | H46: √ | J46: =E46 -> 88 | K46: 95
A47: 43 | B47: 20225010 | C47: 陈佳豪 | D47: 22电子信息工程（一本）2班 | E47: 100 | F47: √ | G47: √ | H47: √ | J47: =E47 -> 100 | K47: 95
A48: 44 | B48: 20225011 | C48: 李婷 | D48: 22电子信息工程（一本）2班 | E48: 94 | F48: √ | G48: √ | H48: √ | J48: =E48 -> 94 | K48: 95
A49: 45 | B49: 20225012 | C49: 陈涵斌 | D49: 22电子信息工程（一本）2班 | E49: 91 | F49: √ | G49: √ | H49: √ | J49: =E49 -> 91 | K49: 95
A50: 46 | B50: 20225013 | C50: 段思涵 | D50: 22电子信息工程（一本）2班 | E50: 91 | F50: √ | G50: √ | H50: √ | J50: =E50 -> 91 | K50: 95
A51: 47 | B51: 20225014 | C51: 何欣 | D51: 22电子信息工程（一本）2班 | E51: 88 | F51: √ | G51: √ | H51: √ | J51: =E51 -> 88 | K51: 95
A52: 48 | B52: 20225015 | C52: 郭硕硕 | D52: 22电子信息工程（一本）2班 | E52: 91 | F52: √ | G52: √ | H52: √ | J52: =E52 -> 91 | K52: 95
A53: 49 | B53: 20225016 | C53: 周佳杰 | D53: 22电子信息工程（一本）2班 | E53: 84 | F53: √ | G53: √ | H53: √ | J53: =E53 -> 84 | K53: 95
A54: 50 | B54: 20225017 | C54: 陈富康 | D54: 22电子信息工程（一本）2班 | E54: 91 | F54: √ | G54: √ | H54: √ | J54: =E54 -> 91 | K54: 95
A55: 51 | B55: 20225018 | C55: 谢子艺 | D55: 22电子信息工程（一本）2班 | E55: 97 | F55: √ | G55: √ | H55: √ | J55: =E55 -> 97 | K55: 95
A56: 52 | B56: 20225019 | C56: 鄢菁菁 | D56: 22电子信息工程（一本）2班 | E56: 94 | F56: √ | G56: √ | H56: √ | J56: =E56 -> 94 | K56: 95
A57: 53 | B57: 20225020 | C57: 黄城梦 | D57: 22电子信息工程（一本）2班 | E57: 84 | F57: √ | G57: √ | H57: √ | J57: =E57 -> 84 | K57: 95
A58: 55 | B58: 20225022 | C58: 徐佳玲 | D58: 22电子信息工程（一本）2班 | E58: 94 | F58: √ | G58: √ | H58: √ | J58: =E58 -> 94 | K58: 95
A59: 56 | B59: 20225023 | C59: 欧阳湘橘 | D59: 22电子信息工程（一本）2班 | E59: 91 | F59: √ | G59: √ | H59: √ | J59: =E59 -> 91 | K59: 95
A60: 57 | B60: 20225024 | C60: 余汶鑫 | D60: 22电子信息工程（一本）2班 | E60: 90 | F60: √ | G60: √ | H60: √ | J60: =E60 -> 90 | K60: 95
A61: 58 | B61: 20225025 | C61: 谭聪 | D61: 22电子信息工程（一本）2班 | E61: 96 | F61: √ | G61: √ | H61: √ | J61: =E61 -> 96 | K61: 95
A62: 59 | B62: 20225026 | C62: 黎宸翊 | D62: 22电子信息工程（一本）2班 | E62: 97 | F62: √ | G62: √ | H62: √ | J62: =E62 -> 97 | K62: 95
A63: 60 | B63: 20225027 | C63: 揭彰烜 | D63: 22电子信息工程（一本）2班 | E63: 100 | F63: √ | G63: √ | H63: √ | J63: =E63 -> 100 | K63: 95
A64: 61 | B64: 20225028 | C64: 罗嘉欣 | D64: 22电子信息工程（一本）2班 | E64: 93 | F64: √ | G64: √ | H64: √ | J64: =E64 -> 93 | K64: 95
A65: 62 | B65: 20225029 | C65: 欧阳路 | D65: 22电子信息工程（一本）2班 | E65: 82 | F65: √ | G65: √ | H65: √ | J65: =E65 -> 82 | K65: 95
A66: 63 | B66: 20225030 | C66: 伍文杰 | D66: 22电子信息工程（一本）2班 | E66: 100 | F66: √ | G66: √ | H66: √ | J66: =E66 -> 100 | K66: 95
A67: 64 | B67: 20225031 | C67: 黄熠阳 | D67: 22电子信息工程（一本）2班 | F67: √ | G67: √ | H67: √ | J67: =E67 -> 0 | K67: 95
A68: 65 | B68: 20225032 | C68: 范雨悦 | D68: 22电子信息工程（一本）2班 | E68: 90 | F68: √ | G68: √ | H68: √ | J68: =E68 -> 90 | K68: 95
A69: 66 | B69: 20225033 | C69: 郭冉 | D69: 22电子信息工程（一本）2班 | E69: 88 | F69: √ | G69: √ | H69: √ | J69: =E69 -> 88 | K69: 95
A70: 67 | B70: 20225034 | C70: 鲁佳 | D70: 22电子信息工程（一本）2班 | E70: 85 | F70: √ | G70: √ | H70: √ | J70: =E70 -> 85 | K70: 95
A71: 68 | B71: 20225035 | C71: 张颖 | D71: 22电子信息工程（一本）2班 | E71: 97 | F71: √ | G71: √ | H71: √ | J71: =E71 -> 97 | K71: 95
A72: 69 | B72: 20225036 | C72: 姚雨彤 | D72: 22电子信息工程（一本）2班 | E72: 94 | F72: √ | G72: √ | H72: √ | J72: =E72 -> 94 | K72: 95
A73: 71 | B73: 20225038 | C73: 董玟润 | D73: 22电子信息工程（一本）2班 | E73: 85 | F73: √ | G73: √ | H73: √ | J73: =E73 -> 85 | K73: 95
A74: 72 | B74: 20225039 | C74: 谭祖姚 | D74: 22电子信息工程（一本）2班 | E74: 97 | F74: √ | G74: √ | H74: √ | J74: =E74 -> 97 | K74: 95
A75: 73 | B75: 20225040 | C75: 刘语 | D75: 22电子信息工程（一本）2班 | E75: 93 | F75: √ | G75: √ | H75: √ | J75: =E75 -> 93 | K75: 95
A76: 74 | B76: 20225041 | C76: 方睿 | D76: 22电子信息工程（一本）2班 | E76: 91 | F76: √ | G76: √ | H76: √ | J76: =E76 -> 91 | K76: 95
A77: 75 | B77: 20225042 | C77: 刘志聪 | D77: 22电子信息工程（一本）2班 | E77: 78 | F77: √ | G77: √ | H77: √ | J77: =E77 -> 78 | K77: 95
A78: 76 | B78: 20225043 | C78: 胡佳佳 | D78: 22电子信息工程（一本）2班 | E78: 84 | F78: √ | G78: √ | H78: √ | J78: =E78 -> 84 | K78: 95
A79: 77 | B79: 20225044 | C79: 郑雅君 | D79: 22电子信息工程（一本）2班 | E79: 87 | F79: √ | G79: √ | H79: √ | J79: =E79 -> 87 | K79: 95
A80: 78 | B80: 20225045 | C80: 万书婷 | D80: 22电子信息工程（一本）2班 | E80: 93 | F80: √ | G80: √ | H80: √ | J80: =E80 -> 93 | K80: 95
A81: 79 | B81: 20225046 | C81: 王美珍 | D81: 22电子信息工程（一本）2班 | E81: 93 | F81: √ | G81: √ | H81: √ | J81: =E81 -> 93 | K81: 95
A82: 80 | B82: 20225047 | C82: 欧阳谦 | D82: 22电子信息工程（一本）2班 | E82: 88 | F82: √ | G82: √ | H82: √ | J82: =E82 -> 88 | K82: 95