A1: 项目5 常见集成芯片的使用（课程目标1、3、4）
A2: 序号 | B2: 学号 | C2: 姓名 | D2: 班级 | E2: 项目表现 | F2: 作品测试 | L2: 终身学习 | N2: 项目表现 | O2: 作品测试 | P2: 终身学习 | R2: 作品测试评分细则：95分：测试点3个√，且功能完成实现；85分：测试点3个√，且功能部分实现；75分：测试点2个或1个√，且功能完全实现或部分实现；65分：测试点2个或1个√，且功能未实现；50分：测试点0个√，且且功能完全实现或部分实现或未实现；
E3: 电路板工艺 | F3: 测试点1 | G3: 测试点2 | H3: 测试点3 | I3: 功能完全实现 | J3: 功能部分实现 | K3: 无任何功能 | L3: 问卷调查
A4: 1 | B4: 20224968 | C4: 李诚 | D4: 22电子信息工程（一本）1班 | E4: 75 | N4: =E4 -> 75 | P4: =L4 -> 0
A5: 2 | B5: 20224969 | C5: 廖凯 | D5: 22电子信息工程（一本）1班 | E5: 78 | N5: =E5 -> 78 | P5: =L5 -> 0
A6: 3 | B6: 20224970 | C6: 陈依如 | D6: 22电子信息工程（一本）1班 | E6: 85 | N6: =E6 -> 85 | P6: =L6 -> 0
A7: 4 | B7: 20224971 | C7: 谢超 | D7: 22电子信息工程（一本）1班 | E7: 81 | N7: =E7 -> 81 | P7: =L7 -> 0
A8: 5 | B8: 20224972 | C8: 啜雨欣 | D8: 22电子信息工程（一本）1班 | E8: 88 | N8: =E8 -> 88 | P8: =L8 -> 0
A9: 6 | B9: 20224973 | C9: 刘亚宁 | D9: 22电子信息工程（一本）1班 | E9: 93 | N9: =E9 -> 93 | P9: =L9 -> 0
A10: 7 | B10: 20224974 | C10: 周世愉 | D10: 22电子信息工程（一本）1班 | E10: 80 | N10: =E10 -> 80 | P10: =L10 -> 0
A11: 8 | B11: 20224975 | C11: 陈志敏 | D11: 22电子信息工程（一本）1班 | E11: 84 | N11: =E11 -> 84 | P11: =L11 -> 0
A12: 9 | B12: 20224976 | C12: 李欣 | D12: 22电子信息工程（一本）1班 | E12: 87 | N12: =E12 -> 87 | P12: =L12 -> 0
A13: 10 | B13: 20224977 | C13: 陈辉 | D13: 22电子信息工程（一本）1班 | E13: 0 | N13: =E13 -> 0 | P13: =L13 -> 0
A14: 11 | B14: 20224978 | C14: 黄影 | D14: 22电子信息工程（一本）1班 | E14: 86 | N14: =E14 -> 86 | P14: =L14 -> 0
A15: 12 | B15: 20224979 | C15: 温李吟雪 | D15: 22电子信息工程（一本）1班 | E15: 88 | N15: =E15 -> 88 | P15: =L15 -> 0
A16: 13 | B16: 20224980 | C16: 彭敏 | D16: 22电子信息工程（一本）1班 | E16: 85 | N16: =E16 -> 85 | P16: =L16 -> 0
A17: 14 | B17: 20224981 | C17: 龚琪 | D17: 22电子信息工程（一本）1班 | E17: 84 | N17: =E17 -> 84 | P17: =L17 -> 0
A18: 15 | B18: 20224982 | C18: 钟鹏飞 | D18: 22电子信息工程（一本）1班 | E18: 80 | N18: =E18 -> 80 | P18: =L18 -> 0
A19: 16 | B19: 20224983 | C19: 张雨娜 | D19: 22电子信息工程（一本）1班 | E19: 89 | N19: =E19 -> 89 | P19: =L19 -> 0
A20: 17 | B20: 20224984 | C20: 张日华 | D20: 22电子信息工程（一本）1班 | E20: 93 | N20: =E20 -> 93 | P20: =L20 -> 0
A21: 18 | B21: 20224985 | C21: 张微 | D21: 22电子信息工程（一本）1班 | E21: 95 | N21: =E21 -> 95 | P21: =L21 -> 0
A22: 19 | B22: 20224986 | C22: 张越 | D22: 22电子信息工程（一本）1班 | E22: 89 | N22: =E22 -> 89 | P22: =L22 -> 0
A23: 20 | B23: 20224987 | C23: 刘振经 | D23: 22电子信息工程（一本）1班 | E23: 0 | N23: =E23 -> 0 | P23: =L23 -> 0
A24: 21 | B24: 20224988 | C24: 龚静薇 | D24: 22电子信息工程（一本）1班 | E24: 97 | N24: =E24 -> 97 | P24: =L24 -> 0
A25: 22 | B25: 20224989 | C25: 胡梓瑞 | D25: 22电子信息工程（一本）1班 | E25: 90 | N25: =E25 -> 90 | P25: =L25 -> 0
A26: 23 | B26: 20224990 | C26: 游梓鑫 | D26: 22电子信息工程（一本）1班 | E26: 81 | N26: =E26 -> 81 | P26: =L26 -> 0
A27: 24 | B27: 20224991 | C27: 曾莉 | D27: 22电子信息工程（一本）1班 | E27: 89 | N27: =E27 -> 89 | P27: =L27 -> 0
A28: 25 | B28: 20224992 | C28: 张馨怡 | D28: 22电子信息工程（一本）1班 | E28: 0 | N28: =E28 -> 0 | P28: =L28 -> 0
A29: 26 | B29: 20224993 | C29: 吴光杰 | D29: 22电子信息工程（一本）1班 | E29: 97 | N29: =E29 -> 97 | P29: =L29 -> 0
A30: 27 | B30: 20224994 | C30: 乐思蕊 | D30: 22电子信息工程（一本）1班 | E30: 95 | N30: =E30 -> 95 | P30: =L30 -> 0
A31: 28 | B31: 20224995 | C31: 王至尧 | D31: 22电子信息工程（一本）1班 | E31: 84 | N31: =E31 -> 84 | P31: =L31 -> 0
A32: 29 | B32: 20224996 | C32: 高官亮 | D32: 22电子信息工程（一本）1班 | E32: 70 | N32: =E32 -> 70 | P32: =L32 -> 0
A33: 30 | B33: 20224997 | C33: 朱武略 | D33: 22电子信息工程（一本）1班 | E33: 79 | N33: =E33 -> 79 | P33: =L33 -> 0
A34: 31 | B34: 20224998 | C34: 王世璇 | D34: 22电子信息工程（一本）1班 | E34: 68 | N34: =E34 -> 68 | P34: =L34 -> 0
A35: 32 | B35: 20224999 | C35: 徐春林 | D35: 22电子信息工程（一本）1班 | E35: 81 | N35: =E35 -> 81 | P35: =L35 -> 0
A36: 33 | B36: 20225000 | C36: 周彬 | D36: 22电子信息工程（一本）1班 | E36: 80 | N36: =E36 -> 80 | P36: =L36 -> 0
A37: 34 | B37: 20225001 | C37: 熊思婕 | D37: 22电子信息工程（一本）1班 | E37: 81 | N37: =E37 -> 81 | P37: =L37 -> 0
A38: 35 | B38: 20225002 | C38: 万佳豪 | D38: 22电子信息工程（一本）1班 | E38: 80 | N38: =E38 -> 80 | P38: =L38 -> 0
A39: 36 | B39: 20225003 | C39: 洪晓莉 | D39: 22电子信息工程（一本）1班 | E39: 91 | N39: =E39 -> 91 | P39: =L39 -> 0
A40: 37 | B40: 20225004 | C40: 肖朝鑫 | D40: 22电子信息工程（一本）1班 | E40: 86 | N40: =E40 -> 86 | P40: =L40 -> 0
A41: 38 | B41: 20225005 | C41: 师甜甜 | D41: 22电子信息工程（一本）1班 | E41: 87 | N41: =E41 -> 87 | P41: =L41 -> 0
A42: 39 | B42: 20225006 | C42: 张斌 | D42: 22电子信息工程（一本）1班 | E42: 85 | N42: =E42 -> 85 | P42: =L42 -> 0
A43: 40 | B43: 20225007 | C43: 王冠棋 | D43: 22电子信息工程（一本）1班 | E43: 95 | N43: =E43 -> 95 | P43: =L43 -> 0
N44: =E44 -> 0 | P44: =L44 -> 0
A45: 41 | B45: 20225008 | C45: 李璇 | D45: 22电子信息工程（一本）2班 | E45: 95 | N45: =E45 -> 95 | P45: =L45 -> 0
A46: 42 | B46: 20225009 | C46: 张华康 | D46: 22电子信息工程（一本）2班 | E46: 85
A47: 43 | B47: 20225010 | C47: 陈佳豪 | D47: 22电子信息工程（一本）2班 | E47: 78
A48: 44 | B48: 20225011 | C48: 李婷 | D48: 22电子信息工程（一本）2班 | E48: 91
A49: 45 | B49: 20225012 | C49: 陈涵斌 | D49: 22电子信息工程（一本）2班 | E49: 65
A50: 46 | B50: 20225013 | C50: 段思涵 | D50: 22电子信息工程（一本）2班 | E50: 0
A51: 47 | B51: 20225014 | C51: 何欣 | D51: 22电子信息工程（一本）2班 | E51: 88
A52: 48 | B52: 20225015 | C52: 郭硕硕 | D52: 22电子信息工程（一本）2班 | E52: 92
A53: 49 | B53: 20225016 | C53: 周佳杰 | D53: 22电子信息工程（一本）2班 | E53: 89
A54: 50 | B54: 20225017 | C54: 陈富康 | D54: 22电子信息工程（一本）2班 | E54: 0
A55: 51 | B55: 20225018 | C55: 谢子艺 | D55: 22电子信息工程（一本）2班 | E55: 91
A56: 52 | B56: 20225019 | C56: 鄢菁菁 | D56: 22电子信息工程（一本）2班 | E56: 85
A57: 53 | B57: 20225020 | C57: 黄城梦 | D57: 22电子信息工程（一本）2班 | E57: 86
A58: 54 | B58: 20225021 | C58: 黄苏杨 | D58: 22电子信息工程（一本）2班 | E58: 0
A59: 55 | B59: 20225022 | C59: 徐佳玲 | D59: 22电子信息工程（一本）2班 | E59: 81
A60: 56 | B60: 20225023 | C60: 欧阳湘橘 | D60: 22电子信息工程（一本）2班 | E60: 0
A61: 57 | B61: 20225024 | C61: 余汶鑫 | D61: 22电子信息工程（一本）2班 | E61: 78
A62: 58 | B62: 20225025 | C62: 谭聪 | D62: 22电子信息工程（一本）2班 | E62: 80
A63: 59 | B63: 20225026 | C63: 黎宸翊 | D63: 22电子信息工程（一本）2班 | E63: 90
A64: 60 | B64: 20225027 | C64: 揭彰烜 | D64: 22电子信息工程（一本）2班 | E64: 90
A65: 61 | B65: 20225028 | C65: 罗嘉欣 | D65: 22电子信息工程（一本）2班 | E65: 84
A66: 62 | B66: 20225029 | C66: 欧阳路 | D66: 22电子信息工程（一本）2班 | E66: 95
A67: 63 | B67: 20225030 | C67: 伍文杰 | D67: 22电子信息工程（一本）2班 | E67: 87
A68: 64 | B68: 20225031 | C68: 黄熠阳 | D68: 22电子信息工程（一本）2班 | E68: 70
A69: 65 | B69: 20225032 | C69: 范雨悦 | D69: 22电子信息工程（一本）2班 | E69: 92
A70: 66 | B70: 20225033 | C70: 郭冉 | D70: 22电子信息工程（一本）2班 | E70: 0
A71: 67 | B71: 20225034 | C71: 鲁佳 | D71: 22电子信息工程（一本）2班 | E71: 0
A72: 68 | B72: 20225035 | C72: 张颖 | D72: 22电子信息工程（一本）2班 | E72: 85
A73: 69 | B73: 20225036 | C73: 姚雨彤 | D73: 22电子信息工程（一本）2班 | E73: 81
A74: 70 | B74: 20225037 | C74: 徐文杰 | D74: 22电子信息工程（一本）2班 | E74: 0
A75: 71 | B75: 20225038 | C75: 董玟润 | D75: 22电子信息工程（一本）2班 | E75: 90
A76: 72 | B76: 20225039 | C76: 谭祖姚 | D76: 22电子信息工程（一本）2班 | E76: 86
A77: 73 | B77: 20225040 | C77: 刘语 | D77: 22电子信息工程（一本）2班 | E77: 0
A78: 74 | B78: 20225041 | C78: 方睿 | D78: 22电子信息工程（一本）2班 | E78: 0
A79: 75 | B79: 20225042 | C79: 刘志聪 | D79: 22电子信息工程（一本）2班 | E79: 0
A80: 76 | B80: 20225043 | C80: 胡佳佳 | D80: 22电子信息工程（一本）2班 | E80: 85
A81: 77 | B81: 20225044 | C81: 郑雅君 | D81: 22电子信息工程（一本）2班 | E81: 87
A82: 78 | B82: 20225045 | C82: 万书婷 | D82: 22电子信息工程（一本）2班 | E82: 89
A83: 79 | B83: 20225046 | C83: 王美珍 | D83: 22电子信息工程（一本）2班 | E83: 94
A84: 80 | B84: 20225047 | C84: 欧阳谦 | D84: 22电子信息工程（一本）2班 | E84: 70